{
  "content_id": "19ed8498-37ed-4c8e-b0bf-accbb2cf5477",
  "base_path":"/government/case-studies/bubble-trouble",
  "format":"unpublishing",
  "locale":"en",
  "public_updated_at":"2014-04-30T23:01:51.000+00:00",
  "publishing_app": "whitehall",
  "rendering_app": "government-frontend",
  "update_type": "major",
  "routes": [
    {
      "path": "/government/case-studies/bubble-trouble",
      "type": "exact"
    }
  ],
  "links":{
    "can_be_replaced_by": [
      "780026aa-a564-434f-9b37-8d83c0ba3d3b"
    ]
  }
}
